{
  "$schema": "https://json-schema.org/draft/2020-12/schema",
  "$id": "compatibility-matrix.schema.json",
  "title": "Agent Compatibility Matrix v1",
  "type": "object",
  "additionalProperties": false,
  "required": ["schema_version", "surfaces", "read_cases", "frame_assignment_cases", "rollback_cases"],
  "properties": {
    "schema_version": {"const": "1.0"},
    "surfaces": {"type": "array", "minItems": 1, "items": {"$ref": "#/$defs/surface"}},
    "read_cases": {"type": "array", "minItems": 5, "items": {"$ref": "#/$defs/case"}},
    "frame_assignment_cases": {"type": "array", "minItems": 7, "items": {"$ref": "#/$defs/case"}},
    "rollback_cases": {"type": "array", "minItems": 3, "items": {"$ref": "#/$defs/case"}}
  },
  "$defs": {
    "surface": {
      "type": "object",
      "additionalProperties": false,
      "required": ["surface", "legacy", "v1"],
      "properties": {
        "surface": {"type": "string", "minLength": 1},
        "legacy": {"type": "string", "minLength": 1},
        "v1": {"type": "string", "minLength": 1}
      }
    },
    "case": {
      "type": "object",
      "minProperties": 2,
      "propertyNames": {"pattern": "^[a-z][a-z0-9_]*$"},
      "additionalProperties": {"type": ["string", "boolean", "number", "null", "array"]}
    }
  }
}
