{
  "schema_version": "1.0",
  "surfaces": [
    {"surface": "ChatTurnRequest", "legacy": "authoritative", "v1": "same_public_shape"},
    {"surface": "ChatTurnResponse", "legacy": "authoritative", "v1": "additive_conversation_projection"},
    {"surface": "SSE", "legacy": "characterized", "v1": "additive_terminal_projection"},
    {"surface": "Message.metadata_json", "legacy": "read_write", "v1": "legacy_read_preserved"},
    {"surface": "Message.interaction_blocks", "legacy": "absent", "v1": "versioned_additive_projection"},
    {"surface": "ChatSession scenario state", "legacy": "execution_authority", "v1": "compatibility_projection_only"},
    {"surface": "scenario_frames", "legacy": "absent", "v1": "execution_authority"},
    {"surface": "Provider contracts", "legacy": "local_direct", "v1": "service_specific_contract_later"}
  ],
  "read_cases": [
    {"case": "v0_only", "read_source": "legacy", "write_behavior": "legacy_only", "metric": "compat.v0_read"},
    {"case": "v1_only", "read_source": "v1", "write_behavior": "v1_only", "metric": "compat.v1_read"},
    {"case": "both_consistent", "read_source": "v1", "write_behavior": "phase_specific", "metric": "compat.dual_consistent"},
    {"case": "both_divergent", "read_source": "phase_authority", "write_behavior": "no_read_time_repair", "error": "COMPAT_PROJECTION_DIVERGED", "metric": "compat.dual_divergent"},
    {"case": "v1_partial_or_invalid", "read_source": "legacy_if_legacy_authoritative_else_pause", "write_behavior": "no_guessing", "error": "V1_RECORD_INVALID", "metric": "compat.v1_invalid"}
  ],
  "frame_assignment_cases": [
    {"legacy_nonterminal_work": true, "flag": "off", "new_frame_runtime": "legacy"},
    {"legacy_nonterminal_work": true, "flag": "on", "new_frame_runtime": "legacy", "reason": "mixed_nonterminal_runtime_forbidden"},
    {"legacy_nonterminal_work": false, "flag": "off", "new_frame_runtime": "legacy"},
    {"legacy_nonterminal_work": false, "flag": "on", "new_frame_runtime": "graph_v1"},
    {"v1_nonterminal_work": true, "legacy_start_requested": true, "selected_runtime": "graph_v1", "legacy_write": "rejected", "error": "SCENARIO_RUNTIME_CONFLICT"},
    {"concurrent_claims": ["legacy", "graph_v1"], "winner": "session_cas_winner", "loser": "reread_and_route_to_winner"},
    {"resume_frame_runtime": "legacy", "flag": "any", "selected_runtime": "legacy"},
    {"resume_frame_runtime": "graph_v1", "flag": "any", "selected_runtime": "graph_v1"},
    {"resume_frame_runtime": "graph_v1", "runtime_available": false, "selected_runtime": "paused", "error": "RUNTIME_VERSION_UNAVAILABLE"}
  ],
  "rollback_cases": [
    {"nonterminal_v1_frames": false, "action": "disable_new_v1_assignment"},
    {"nonterminal_v1_frames": true, "runtime_available": true, "action": "disable_new_assignment_and_drain_pinned_runtime"},
    {"nonterminal_v1_frames": true, "runtime_available": false, "action": "pause_without_runtime_substitution"}
  ]
}
